year,taxa,impact,effect,country,country_code,location,location_short,location_code,author,title,doi
2021,invertebrates,direct,collision,Germany,DE,Europe,Europe,EU,Voigt,Insect fatalities at wind turbines as biodiversity sinks.,https://doi.org/10.1111/csp2.366
2021,invertebrates,direct,habitat_alteration,Netherlands,NL,Europe,Europe,EU,Velilla et al. ,Vibrational noise from wind energy-turbines negatively impacts earthworm abundance. ,https://doi.org/10.1111/oik.08166
2021,invertebrates,direct,habitat_alteration,Sweden,SE,Europe,Europe,EU,de Jong et al.,Activity pattern and correlation between bat and insect abundance at wind turbines in South Sweden.,https://doi.org/10.3390/ani11113269
2021,mammals,direct,habitat_alteration,Multiple,MUL,Multiple,Multiple,MUL,Scholl & Nopp-Mayr,Impact of wind power plants on mammalian and avian wildlife species in shrub - and woodlands.,https://doi-org.elib.tcd.ie/10.1016/j.biocon.2021.109037
2021,mammals,disturbance,alteration_trophic_levels,Spain,ES,Europe,Europe,EU,Gomez-Catasus et al.,Landscape features associated to wind farms increase mammalian predator abundance and ground-nest predation.,https://doi.org/10.1007/s10531-021-02212-9
2021,vegetation,direct,habitat_alteration,Romania,RO,Europe,Europe,EU,Urziceanu et al.,"Local-scale impact of wind energy farms on rare, endemic, and threatened plant species.",https://doi.org/10.7717/peerj.11390
